{"aggregate":{"all_scheduled_runs_included":true,"cases":32,"fault_cases":2,"head_to_head_cases":24,"interaction_cases":2,"maximum_wall_seconds":9.072448,"mixed_field_cases":2,"native_runs":64,"opponents":3,"projection_replay_exact_cases":32,"replicates":64,"seed_blocks":6,"solo_cases":2},"artifact_root":"/home/thecl/.codex/artifacts/openttd-rl/v2-m20-competition-matrix-f","cases":[{"case_id":"round-robin-aaahogex-s0-a","leg":"A","map_seed":190521439,"probe":"head_to_head","projection_replay_exact":true,"replicate_metrics":[{"company_value_differences":[9475104],"fault_contained":true,"opponent_states":[{"alive":true,"company_value":488088,"delivered_cargo_units":18638,"name":"AAAHogEx","operating_profit":413883}],"rl":{"alive":true,"company_value":9963192,"delivered_cargo_units":138,"operating_profit":-4620},"save_load_public_exact":true},{"company_value_differences":[9475104],"fault_contained":true,"opponent_states":[{"alive":true,"company_value":488088,"delivered_cargo_units":18638,"name":"AAAHogEx","operating_profit":413883}],"rl":{"alive":true,"company_value":9963192,"delivered_cargo_units":138,"operating_profit":-4620},"save_load_public_exact":true}],"replicates":[{"name":"a","normalized_sha256":"93c2d21043353c4246f7853b7cc9de9beaa6111878ff2eafca5c8540dd3b1752","report_path":"round-robin-aaahogex-s0-a/replicate-a/report.json","report_sha256":"68ade327a3e9450d934aab2e28062391e9bb1ac6250b632581d729580fbbcefb","wall_seconds":3.964865},{"name":"b","normalized_sha256":"93c2d21043353c4246f7853b7cc9de9beaa6111878ff2eafca5c8540dd3b1752","report_path":"round-robin-aaahogex-s0-a/replicate-b/report.json","report_sha256":"f9ee8debbe6ea26a0c4d7823d0bf9421edebfd59c145c5d0e1d0bfa8827d2198","wall_seconds":3.925294}],"seed_ordinal":0,"simulation_seed":532039881},{"case_id":"round-robin-aaahogex-s0-b","leg":"B","map_seed":190521439,"probe":"head_to_head","projection_replay_exact":true,"replicate_metrics":[{"company_value_differences":[9441060],"fault_contained":true,"opponent_states":[{"alive":true,"company_value":522072,"delivered_cargo_units":18349,"name":"AAAHogEx","operating_profit":443647}],"rl":{"alive":true,"company_value":9963132,"delivered_cargo_units":136,"operating_profit":-4680},"save_load_public_exact":true},{"company_value_differences":[9441060],"fault_contained":true,"opponent_states":[{"alive":true,"company_value":522072,"delivered_cargo_units":18349,"name":"AAAHogEx","operating_profit":443647}],"rl":{"alive":true,"company_value":9963132,"delivered_cargo_units":136,"operating_profit":-4680},"save_load_public_exact":true}],"replicates":[{"name":"a","normalized_sha256":"955a5626cac2c5be892ae521143f4f926501f97ad4592081718433580998476e","report_path":"round-robin-aaahogex-s0-b/replicate-a/report.json","report_sha256":"e36c1c79e7318d87aee810106ff9faf637b0e73afa7d63d8a4dbb86beb335946","wall_seconds":3.953284},{"name":"b","normalized_sha256":"955a5626cac2c5be892ae521143f4f926501f97ad4592081718433580998476e","report_path":"round-robin-aaahogex-s0-b/replicate-b/report.json","report_sha256":"c317d213831562a1fe98b004a4a5950f0169bf30c956f0680abf6a683808c7a6","wall_seconds":4.056151}],"seed_ordinal":0,"simulation_seed":532039881},{"case_id":"round-robin-aaahogex-s0-c","leg":"C","map_seed":190521439,"probe":"head_to_head","projection_replay_exact":true,"replicate_metrics":[{"company_value_differences":[9104795],"fault_contained":true,"opponent_states":[{"alive":true,"company_value":867299,"delivered_cargo_units":41598,"name":"AAAHogEx","operating_profit":1107484}],"rl":{"alive":true,"company_value":9972094,"delivered_cargo_units":78,"operating_profit":-1976},"save_load_public_exact":true},{"company_value_differences":[9116484],"fault_contained":true,"opponent_states":[{"alive":true,"company_value":855519,"delivered_cargo_units":41531,"name":"AAAHogEx","operating_profit":1108379}],"rl":{"alive":true,"company_value":9972003,"delivered_cargo_units":75,"operating_profit":-2067},"save_load_public_exact":true}],"replicates":[{"name":"a","normalized_sha256":"24d891b3878b962c920a68f24a3e6b722ce393ce2e90204cf5552d8fa722bece","report_path":"round-robin-aaahogex-s0-c/replicate-a/report.json","report_sha256":"a641f1a09640bb9d1c49018908cb88c0dbeab73042ef1024985a0c2168a27367","wall_seconds":7.69165},{"name":"b","normalized_sha256":"5d7104ad14ba9dbbbe2756a17ec23c97ed4df7496d5f30cf289becf84db53034","report_path":"round-robin-aaahogex-s0-c/replicate-b/report.json","report_sha256":"25d4edc3ae20e5201cce3265652b9d462e4a2a099bedbbd9b107929a4abe51f1","wall_seconds":8.176735}],"seed_ordinal":0,"simulation_seed":532039881},{"case_id":"round-robin-aaahogex-s0-d","leg":"D","map_seed":190521439,"probe":"head_to_head","projection_replay_exact":true,"replicate_metrics":[{"company_value_differences":[9142412],"fault_contained":true,"opponent_states":[{"alive":true,"company_value":830152,"delivered_cargo_units":40772,"name":"AAAHogEx","operating_profit":1006611}],"rl":{"alive":true,"company_value":9972564,"delivered_cargo_units":104,"operating_profit":-1246},"save_load_public_exact":true},{"company_value_differences":[9142412],"fault_contained":true,"opponent_states":[{"alive":true,"company_value":830152,"delivered_cargo_units":40772,"name":"AAAHogEx","operating_profit":1006611}],"rl":{"alive":true,"company_value":9972564,"delivered_cargo_units":104,"operating_profit":-1246},"save_load_public_exact":true}],"replicates":[{"name":"a","normalized_sha256":"0159e1032411a517b67f19777c8146c32f4c5498ed94b12dfc8ef6fb73454874","report_path":"round-robin-aaahogex-s0-d/replicate-a/report.json","report_sha256":"ce0b2876b44571a10bf5e7698299e6357eaaaf7529e2947adbd91ca4162e3d0f","wall_seconds":7.448765},{"name":"b","normalized_sha256":"0159e1032411a517b67f19777c8146c32f4c5498ed94b12dfc8ef6fb73454874","report_path":"round-robin-aaahogex-s0-d/replicate-b/report.json","report_sha256":"e0f9ec6114b9cf8d6b363e49f9a9988eb751f00767aa03f4b14b6f2e51f48050","wall_seconds":7.27893}],"seed_ordinal":0,"simulation_seed":532039881},{"case_id":"round-robin-aaahogex-s1-a","leg":"A","map_seed":458833225,"probe":"head_to_head","projection_replay_exact":true,"replicate_metrics":[{"company_value_differences":[9351147],"fault_contained":true,"opponent_states":[{"alive":true,"company_value":605726,"delivered_cargo_units":17022,"name":"AAAHogEx","operating_profit":556305}],"rl":{"alive":true,"company_value":9956873,"delivered_cargo_units":450,"operating_profit":-5550},"save_load_public_exact":true},{"company_value_differences":[9351147],"fault_contained":true,"opponent_states":[{"alive":true,"company_value":605726,"delivered_cargo_units":17022,"name":"AAAHogEx","operating_profit":556305}],"rl":{"alive":true,"company_value":9956873,"delivered_cargo_units":450,"operating_profit":-5550},"save_load_public_exact":true}],"replicates":[{"name":"a","normalized_sha256":"08646baee71f42f911b60683d803c853e87f97fe31e8b01de9e27cf01d18bc1e","report_path":"round-robin-aaahogex-s1-a/replicate-a/report.json","report_sha256":"13b0258d0ffa3200b636f15431602f55628597ee5fe7a660b84576ac3e6ae9ed","wall_seconds":3.889886},{"name":"b","normalized_sha256":"08646baee71f42f911b60683d803c853e87f97fe31e8b01de9e27cf01d18bc1e","report_path":"round-robin-aaahogex-s1-a/replicate-b/report.json","report_sha256":"1c16bc18dffb77c76c887c215ba7a5efd310bc4facfcc8c418f50b560425381c","wall_seconds":3.976742}],"seed_ordinal":1,"simulation_seed":733125471},{"case_id":"round-robin-aaahogex-s1-b","leg":"B","map_seed":458833225,"probe":"head_to_head","projection_replay_exact":true,"replicate_metrics":[{"company_value_differences":[9351960],"fault_contained":true,"opponent_states":[{"alive":true,"company_value":604913,"delivered_cargo_units":16522,"name":"AAAHogEx","operating_profit":537835}],"rl":{"alive":true,"company_value":9956873,"delivered_cargo_units":450,"operating_profit":-5550},"save_load_public_exact":true},{"company_value_differences":[9351960],"fault_contained":true,"opponent_states":[{"alive":true,"company_value":604913,"delivered_cargo_units":16522,"name":"AAAHogEx","operating_profit":537835}],"rl":{"alive":true,"company_value":9956873,"delivered_cargo_units":450,"operating_profit":-5550},"save_load_public_exact":true}],"replicates":[{"name":"a","normalized_sha256":"1e5f157076ea5f1d8ada90de289daad0a0280ea42d997850453c119dc08d5b97","report_path":"round-robin-aaahogex-s1-b/replicate-a/report.json","report_sha256":"4c36da3b105d94c009e02938fa796d183b029e199997ef6eddfca59106afbbb6","wall_seconds":4.142446},{"name":"b","normalized_sha256":"1e5f157076ea5f1d8ada90de289daad0a0280ea42d997850453c119dc08d5b97","report_path":"round-robin-aaahogex-s1-b/replicate-b/report.json","report_sha256":"4e8c5fcf1a2e8b8349ac6127ea3dfa04b5f843ca106efb213b93225b1710450a","wall_seconds":4.186922}],"seed_ordinal":1,"simulation_seed":733125471},{"case_id":"round-robin-aaahogex-s1-c","leg":"C","map_seed":458833225,"probe":"head_to_head","projection_replay_exact":true,"replicate_metrics":[{"company_value_differences":[9053853],"fault_contained":true,"opponent_states":[{"alive":true,"company_value":919182,"delivered_cargo_units":46234,"name":"AAAHogEx","operating_profit":1244622}],"rl":{"alive":true,"company_value":9973035,"delivered_cargo_units":33,"operating_profit":-4008},"save_load_public_exact":true},{"company_value_differences":[9053853],"fault_contained":true,"opponent_states":[{"alive":true,"company_value":919182,"delivered_cargo_units":46234,"name":"AAAHogEx","operating_profit":1244622}],"rl":{"alive":true,"company_value":9973035,"delivered_cargo_units":33,"operating_profit":-4008},"save_load_public_exact":true}],"replicates":[{"name":"a","normalized_sha256":"4e1884c49e438811c38c1642f9b95cbad1b0768db9b400e49d4aca7763b6c254","report_path":"round-robin-aaahogex-s1-c/replicate-a/report.json","report_sha256":"6c851ff188727178bedea1bd4f3ceb5074ba6b7724e9d1569840ace83e97366b","wall_seconds":7.605847},{"name":"b","normalized_sha256":"4e1884c49e438811c38c1642f9b95cbad1b0768db9b400e49d4aca7763b6c254","report_path":"round-robin-aaahogex-s1-c/replicate-b/repo